raw_url,context,raw_question,raw_answer,annotated_question,is_impossible
4394,"당신을 사랑하는 사람을 사랑하는 것이 불가능합니까?안녕하세요, 우선, 당신은 당신을 만들기 위해 무언가를 가진 사람들에게 대답 할 수 있습니다. 당신이 실제로 그런 사람에게 가면 기본적으로 그것을 찾을 수 있습니다. 기대하는 것은 불가능하지 않습니다.나는 내가 본 것에 대해 한 사람 이상을 보았다.그러나 당신이 여전히 그런 사람을 사랑할 수 있다고 말하고 싶다면 쉽지 않습니다. 쉽지 않습니다. 어려운 일이됩니다. 왜 당신은 일반적인 상황은 당신이 사랑하는 사람이 당신을 사랑하고, 당신을 사랑하고, 사랑하는 것입니다. 당신은 당신을 사랑하지 않으 셨습니다.물론, 여전히 사랑에는 많은 사랑이 있지만, 그를 사랑하는 것이 조금 번거 롭습니다.어쨌든, 두 사람은 두 명의 독립적 인 개인입니다. 항상 다른 요구와 아이디어가 다릅니다. 사랑하기 때문에 두 사람은 슬리퍼와 양보를 착용 할 것입니다. 한 사람만이 완전한 양보를하고 관계는 불균형이며, 관계는 불균형이며, 관계는 불균형이며, 사랑 때문에 짧은 시간을 유지할 수 있지만 장기적인 관계를 유지하기는 어렵습니다.글쎄, 요약하면, 당신의 기대는 약간 이상적입니다.",당신을 사랑하는 사람을 사랑하는 것이 불가능합니까?,"안녕하세요, 우선, 당신은 당신을 만들기 위해 무언가를 가진 사람들에게 대답 할 수 있습니다. 당신이 실제로 그런 사람에게 가면 기본적으로 그것을 찾을 수 있습니다. 기대하는 것은 불가능하지 않습니다.나는 내가 본 것에 대해 한 사람 이상을 보았다.그러나 당신이 여전히 그런 사람을 사랑할 수 있다고 말하고 싶다면 쉽지 않습니다. 쉽지 않습니다. 어려운 일이됩니다. 왜 당신은 일반적인 상황은 당신이 사랑하는 사람이 당신을 사랑하고, 당신을 사랑하고, 사랑하는 것입니다. 당신은 당신을 사랑하지 않으 셨습니다.물론, 여전히 사랑에는 많은 사랑이 있지만, 그를 사랑하는 것이 조금 번거 롭습니다.어쨌든, 두 사람은 두 명의 독립적 인 개인입니다. 항상 다른 요구와 아이디어가 다릅니다. 사랑하기 때문에 두 사람은 슬리퍼와 양보를 착용 할 것입니다. 한 사람만이 완전한 양보를하고 관계는 불균형이며, 관계는 불균형이며, 관계는 불균형이며, 사랑 때문에 짧은 시간을 유지할 수 있지만 장기적인 관계를 유지하기는 어렵습니다.글쎄, 요약하면, 당신의 기대는 약간 이상적입니다.",당신을 사랑하는 사람을 사랑하는 것이 불가능합니까?,O
4395,"다른 사람들의 학습 때문에 왜 항상 너무 불안합니까?~~ 최근에 나쁜 상태가 있다는 것을 알게되어 죄송합니다. 안아주세요 ~ 당신의 설명을 읽은 후, ""다른 사람들의 학습 때문에 불안감을 느낄 것입니다."" 주변 사람들의 영향을받는 것이 더 쉬울 수 있으며, 압력에 매우 민감하고 경험에 동정합니다.나는 당신이 좋은 세심한 학생이어야한다고 생각하지만 당분간 확고한 학습 방향은 없습니다.당신의 설명에 따르면, ""캠퍼스에서 배우는 자주 배우는 사람들은 진전을하고 싶지 않다고 생각합니다.""이런 종류의 불안은 캠퍼스에서 일반적입니다. 일반적으로 동기 부여, 홍보 우리의 학습 진보, 불안은 우리에게 긍정적 인 영향을 미칩니다.그리고 우리 가이 불안을 정확하게 변화시킬 수 없다면, 외부 개입이 필요하고 불안을 조절해야합니다.당신의 설명에 따르면, ""다른 사람들과의 거리에 대한 두려움, 당신은 항상 진보의 여지가 없다고 생각합니다.""당신의 생각에서, 당신은 아직이 감정을 동기 부여로 바꾸지 않았으므로 필요할 수 있습니다. 예를 들어, 학습 상황을 교사 및 친구와 제 시간에 전달할 때 상황을 평가할 수있게되면 상황이 더 객관적 일 수 있으며 여러 각도에서 학습 상황을 볼 수 있습니다.어쩌면 당신은 또한 당신의 장점과 진보의 여지를 볼 수 있습니다.",다른 사람들의 학습 때문에 왜 항상 너무 불안합니까?,"~~ 최근에 나쁜 상태가 있다는 것을 알게되어 죄송합니다. 안아주세요 ~ 당신의 설명을 읽은 후, ""다른 사람들의 학습 때문에 불안감을 느낄 것입니다."" 주변 사람들의 영향을받는 것이 더 쉬울 수 있으며, 압력에 매우 민감하고 경험에 동정합니다.나는 당신이 좋은 세심한 학생이어야한다고 생각하지만 당분간 확고한 학습 방향은 없습니다.당신의 설명에 따르면, ""캠퍼스에서 배우는 자주 배우는 사람들은 진전을하고 싶지 않다고 생각합니다.""이런 종류의 불안은 캠퍼스에서 일반적입니다. 일반적으로 동기 부여, 홍보 우리의 학습 진보, 불안은 우리에게 긍정적 인 영향을 미칩니다.그리고 우리 가이 불안을 정확하게 변화시킬 수 없다면, 외부 개입이 필요하고 불안을 조절해야합니다.당신의 설명에 따르면, ""다른 사람들과의 거리에 대한 두려움, 당신은 항상 진보의 여지가 없다고 생각합니다.""당신의 생각에서, 당신은 아직이 감정을 동기 부여로 바꾸지 않았으므로 필요할 수 있습니다. 예를 들어, 학습 상황을 교사 및 친구와 제 시간에 전달할 때 상황을 평가할 수있게되면 상황이 더 객관적 일 수 있으며 여러 각도에서 학습 상황을 볼 수 있습니다.어쩌면 당신은 또한 당신의 장점과 진보의 여지를 볼 수 있습니다.",다른 사람들의 학습 때문에 왜 항상 너무 불안합니까?,O
4397,"우리는 그것을 싫어하는 사람들과 어울릴까요?잘 지내는 방법은 가장 좋은 방법입니까?이것은 실제로 문제입니다.두 가지 가능성을 생각하십시오.첫째,이 사람은 그것을 싫어하지만 인생, 공부 및 일에 큰 영향을 미치는 것은 그리 좋지는 않지만 서로 만나면 불편합니다.이 경우, 아마도 당신은 경작으로 ""사람들과 사물을 만나기""를 할 수 있습니다.이 사람, 또는 그의 말과 행동은 당신을 만질 수 있습니다.또한 그러한 사람들과 사물의 기술을 다루는 방법을 실천할 때입니다.둘째,이 사람은 당신에게 큰 어려움을 겪고 있습니다.에너지가 위험하다고 생각되면 부정적인 에너지를 피하는 것이 가장 좋습니다.또는 당신은 자신에게 대처할 수 없으며, 떠나고 자신을 보호 할 필요가 없을 수도 있습니다.또한,이 사람은 얼마나 성가신 지, 얼마나 성가신가?이 사람이 성가 시나요?당신은 모든 것을 싫어합니까?미워하는 사람들과 어울리는 것은 쉽지 않습니다. 서로 어울리는 과정에서 경험과 이익이 있습니까?",우리는 그것을 싫어하는 사람들과 어울릴까요?잘 지내는 방법은 가장 좋은 방법입니까?,"이것은 실제로 문제입니다.두 가지 가능성을 생각하십시오.첫째,이 사람은 그것을 싫어하지만 인생, 공부 및 일에 큰 영향을 미치는 것은 그리 좋지는 않지만 서로 만나면 불편합니다.이 경우, 아마도 당신은 경작으로 ""사람들과 사물을 만나기""를 할 수 있습니다.이 사람, 또는 그의 말과 행동은 당신을 만질 수 있습니다.또한 그러한 사람들과 사물의 기술을 다루는 방법을 실천할 때입니다.둘째,이 사람은 당신에게 큰 어려움을 겪고 있습니다.에너지가 위험하다고 생각되면 부정적인 에너지를 피하는 것이 가장 좋습니다.또는 당신은 자신에게 대처할 수 없으며, 떠나고 자신을 보호 할 필요가 없을 수도 있습니다.또한,이 사람은 얼마나 성가신 지, 얼마나 성가신가?이 사람이 성가 시나요?당신은 모든 것을 싫어합니까?미워하는 사람들과 어울리는 것은 쉽지 않습니다. 서로 어울리는 과정에서 경험과 이익이 있습니까?",우리는 그것을 싫어하는 사람들과 어울릴까요?잘 지내는 방법은 가장 좋은 방법입니까?,O
4398,"움직이는 무언가를 만나면 사고 싶지 않아, 당신은 자신을 사랑하지 않습니까?안녕하세요, 주제!일반적으로 이것은 사실입니다. 나는 그런 사람이었습니다. 나는 귀중한 것을 사기 위해 견딜 수 없었습니다. 나는 그것을 좋아했지만 그것을 사기 위해 견딜 수 없었습니다.수년간의 성장 후, 나는 환경이 재료가 매우 부족했기 때문에 실제로 부적합한 느낌이 들었습니다.이 환경의 영향은 미묘하고 심오하며 내부에는 깊은 감각이 있습니다.경제 조건이 이제 시간과 비교 되더라도 더 이상 같은 날이 아닙니다. 당신은 생존하기 위해 이전처럼 검소할 필요는 없지만,이 관성은 유지되었으며 때로는 무력합니다. 뼈.당신은 그가 당시 가족이 그것을 사기 전까지는 맛있다고 말했습니다. 내 마음에 나는 그것을 나누고 싶었다는 목소리가 있었고, 나는 특히 깊이 느꼈습니다.이렇게 구매하면 정직 할 것입니다. 그렇지 않으면 혼자 먹을 것입니다.나는 내가 어렸을 때, 바나나가 내 동생이 먹기 전에 집에 가기 전까지는 머물러야했지만, 내 동생이 집에 돌아 왔을 때 바나나는 썩었다는 것을 기억합니다.나는 당신이 비슷한 경험을 가지고 있는지 또는 가르치는 것과 비슷한 지 알지 못합니다. 우리의 모든 관성 사고는 과거에 형성되었지만, 그것이 영향을 받는지 여부를 선택할 권리가 있습니다.이제 우리는 머리 속의 소리를 인식 할 수있었습니다. 우리가 알 때마다, 우리는 목소리가 당신을보고, 저항을 정당화하거나 억제하기 위해 도착하는 것과 같은 반응없이 거기에 두는 목소리를 말합니다. 그냥 거기에 넣으십시오.또한, 나는 어린 시절이 아니라고 스스로에게 말할 수 있습니다. 나는 내가 사고 싶은 것을 살 수 있습니다. 나는이 작은 것을 스스로 결정할 수 있습니다. 나는 그것을 위해 그것을 즐길 수 있습니다. 음식, 다른 사람들과 나누지 않아도됩니다. 그만한 가치가 있습니다. . 나는 인생을 즐길 수 있습니다. 내 인생은 다른 사람들을 만족시키는 것이 아닙니다.","움직이는 무언가를 만나면 사고 싶지 않아, 당신은 자신을 사랑하지 않습니까?","안녕하세요, 주제!일반적으로 이것은 사실입니다. 나는 그런 사람이었습니다. 나는 귀중한 것을 사기 위해 견딜 수 없었습니다. 나는 그것을 좋아했지만 그것을 사기 위해 견딜 수 없었습니다.수년간의 성장 후, 나는 환경이 재료가 매우 부족했기 때문에 실제로 부적합한 느낌이 들었습니다.이 환경의 영향은 미묘하고 심오하며 내부에는 깊은 감각이 있습니다.경제 조건이 이제 시간과 비교 되더라도 더 이상 같은 날이 아닙니다. 당신은 생존하기 위해 이전처럼 검소할 필요는 없지만,이 관성은 유지되었으며 때로는 무력합니다. 뼈.당신은 그가 당시 가족이 그것을 사기 전까지는 맛있다고 말했습니다. 내 마음에 나는 그것을 나누고 싶었다는 목소리가 있었고, 나는 특히 깊이 느꼈습니다.이렇게 구매하면 정직 할 것입니다. 그렇지 않으면 혼자 먹을 것입니다.나는 내가 어렸을 때, 바나나가 내 동생이 먹기 전에 집에 가기 전까지는 머물러야했지만, 내 동생이 집에 돌아 왔을 때 바나나는 썩었다는 것을 기억합니다.나는 당신이 비슷한 경험을 가지고 있는지 또는 가르치는 것과 비슷한 지 알지 못합니다. 우리의 모든 관성 사고는 과거에 형성되었지만, 그것이 영향을 받는지 여부를 선택할 권리가 있습니다.이제 우리는 머리 속의 소리를 인식 할 수있었습니다. 우리가 알 때마다, 우리는 목소리가 당신을보고, 저항을 정당화하거나 억제하기 위해 도착하는 것과 같은 반응없이 거기에 두는 목소리를 말합니다. 그냥 거기에 넣으십시오.또한, 나는 어린 시절이 아니라고 스스로에게 말할 수 있습니다. 나는 내가 사고 싶은 것을 살 수 있습니다. 나는이 작은 것을 스스로 결정할 수 있습니다. 나는 그것을 위해 그것을 즐길 수 있습니다. 음식, 다른 사람들과 나누지 않아도됩니다. 그만한 가치가 있습니다. . 나는 인생을 즐길 수 있습니다. 내 인생은 다른 사람들을 만족시키는 것이 아닙니다.","움직이는 무언가를 만나면 사고 싶지 않아, 당신은 자신을 사랑하지 않습니까?",O
4399,"작업은 매우 우울합니다. 어떻게 나 자신과 화해 할 수 있습니까?아니면 변경?다음 답변이 도움이 될 수 있기를 바랍니다. 닐 ** 먼저 다음과 같이 묘사 한 상황을 분류하십시오.▲ 그것을 좋아하는 동료들에 의해 괴롭힘을당하는 것은 훨씬 더 불편합니다.▲ 급여가 너무 많지 않으면 어떻게해야합니까?** 직업 적응 장애 : 설명에서, 그것은 분명히 직업 적응 장애의 문제입니다.사람이 여전히 3 개월 이상 적응할 수 없다고 느끼면 동료 간의 관계는 좋지 않으며 신체에는 다양한 불만족스러운 표시 -물리화가 있어이 직업이나 직무가 적응에 문제가있을 수 있음을 나타냅니다.구체적으로, 압력은 작업의 어려움으로 인한 것입니까?아니면 가난한 동료들에 의한 대인 관계의 고통이 있습니까?아니면 낮은 작업 가치로 인한 개인적인 낮은 가치입니까?** 당신이 생각하는 것에 대해 생각하십시오 : 그러한 근무 환경에서, 그것은 분명히 불행하고 심지어 신체적, 정신적 건강에도 바람직하지 않습니다. 그래서 당신은 어떻게 생각해야합니까, 당신은 정말로 무엇을 원합니까?여기에는 당신의 동기가 포함됩니다.불충분 한 전력은 필연적으로 변형으로 이어질 것입니다.두 가지 옵션이 있습니다. 첫째, 현재 단위와 위치를 유지하려면 가치와 중요성, 특히 개인적인 가치를 찾는 것이 중요합니다.두 번째는 떠나면 사임하는 것입니다. 고려해야합니다. ++ 생계를 유지할 수있는 능력이 있다면 떠나면 살아남을 수 있으며 인생은 너무 많이 변하지 않습니다.++ 또는 자신의 집은 두껍습니다.스스로를 다시 배치하는 방법?Satia는 사람들이 세 번 태어 났다고 말했다.첫 번째 출생은 정자와 계란의 조합으로 활성을 활성화하고 새로운 형태의 활력을 창출하는 것입니다. 두 번째 출생은 어머니의 자궁에서 우리 몸의 출력이며 출생 후 기존 가정 시스템에 들어갔습니다. 우리의 생존은 전적으로 의존합니다. 간병인; 세 번째로 태어난 것은 우리 자신이되기로 한 우리의 결정을 말합니다.그래서, 당신은 무엇을 원하십니까?이 동기는 다음 발전의 가능성이있을 것이라고 분명히 생각할 수 있습니다.ε 나.세상은 당신을 사랑합니다.직접 해결할 수 없다면 도움을 받으려면 상담을 위해 교사를 찾으십시오.",작업은 매우 우울합니다. 어떻게 나 자신과 화해 할 수 있습니까?아니면 변경?,"다음 답변이 도움이 될 수 있기를 바랍니다. 닐 ** 먼저 다음과 같이 묘사 한 상황을 분류하십시오.▲ 그것을 좋아하는 동료들에 의해 괴롭힘을당하는 것은 훨씬 더 불편합니다.▲ 급여가 너무 많지 않으면 어떻게해야합니까?** 직업 적응 장애 : 설명에서, 그것은 분명히 직업 적응 장애의 문제입니다.사람이 여전히 3 개월 이상 적응할 수 없다고 느끼면 동료 간의 관계는 좋지 않으며 신체에는 다양한 불만족스러운 표시 -물리화가 있어이 직업이나 직무가 적응에 문제가있을 수 있음을 나타냅니다.구체적으로, 압력은 작업의 어려움으로 인한 것입니까?아니면 가난한 동료들에 의한 대인 관계의 고통이 있습니까?아니면 낮은 작업 가치로 인한 개인적인 낮은 가치입니까?** 당신이 생각하는 것에 대해 생각하십시오 : 그러한 근무 환경에서, 그것은 분명히 불행하고 심지어 신체적, 정신적 건강에도 바람직하지 않습니다. 그래서 당신은 어떻게 생각해야합니까, 당신은 정말로 무엇을 원합니까?여기에는 당신의 동기가 포함됩니다.불충분 한 전력은 필연적으로 변형으로 이어질 것입니다.두 가지 옵션이 있습니다. 첫째, 현재 단위와 위치를 유지하려면 가치와 중요성, 특히 개인적인 가치를 찾는 것이 중요합니다.두 번째는 떠나면 사임하는 것입니다. 고려해야합니다. ++ 생계를 유지할 수있는 능력이 있다면 떠나면 살아남을 수 있으며 인생은 너무 많이 변하지 않습니다.++ 또는 자신의 집은 두껍습니다.스스로를 다시 배치하는 방법?Satia는 사람들이 세 번 태어 났다고 말했다.첫 번째 출생은 정자와 계란의 조합으로 활성을 활성화하고 새로운 형태의 활력을 창출하는 것입니다. 두 번째 출생은 어머니의 자궁에서 우리 몸의 출력이며 출생 후 기존 가정 시스템에 들어갔습니다. 우리의 생존은 전적으로 의존합니다. 간병인; 세 번째로 태어난 것은 우리 자신이되기로 한 우리의 결정을 말합니다.그래서, 당신은 무엇을 원하십니까?이 동기는 다음 발전의 가능성이있을 것이라고 분명히 생각할 수 있습니다.ε 나.세상은 당신을 사랑합니다.직접 해결할 수 없다면 도움을 받으려면 상담을 위해 교사를 찾으십시오.",작업은 매우 우울합니다. 어떻게 나 자신과 화해 할 수 있습니까?아니면 변경?,O
