raw_url,context,raw_question,raw_answer,annotated_question,is_impossible
4476,"6 개의 기숙사가 있으며 수업 시간은 다릅니다. 대인 관계와 어떻게해야합니까?안녕하세요, 원래 포스터; 대학의 기숙사는 수업에 따라 수업에 의해 관리되지 않습니다.따라서 모든 사람은 다릅니다.선택 과정과 함께 각 수업에는 시간이 다르므로 공통 학습 주제가 없습니다.룸메이트와 좋은 관계를 유지할 수 있다는 것은 대학 생활에 도움이됩니다.당신은 그들을 적극적으로 도와야하며 때로는 그들이 당신을 도와야하며, 시간을 도울 것입니다.당신은 또한 그들과 함께 일반적인 주제에 대해 이야기 할 수 있습니다. 소년들은 게임과 스포츠에 대해 이야기하고, 소녀들은 화장품과 별에 대해 이야기합니다.우리 모두는 우리의 대학 생활과 같은 것이기를 희망합니다 .——— 20은 그와 비슷합니다. 같은 룸메이트가있는 그룹이 있지만 문제는 자신의 감정에 대한 모든 사람의 견해가 다르다는 것입니다. 당신은 다른 사람들과 다른 사람들로 간주합니다. 반드시 그런 것은 아닙니다. 친구로 데려가십시오.집주인은 독립적이어야한다고 생각합니다. 결국, 대학의 우정은 강력하고 강하며 깨지기 쉽고 깨지기 쉽습니다.당신은 더 이상 당신을 무시하고, 더 많은 관심을 썼으며, 당신이 좋아하는 사람들을 향상시키기 위해 더 열심히 노력하는 사람들 앞에서 존재감을 찾을 필요가 없습니다.의식은 여전히 ​​존재하고, 태도가 가까워지고, 다른 곳에서 생각하고 마음을 비교하는 법을 배워야하지만, 허용 할 수없는 요청에 직면하면 집주인은 대담하게 거절해야합니다.",6 개의 기숙사가 있으며 수업 시간은 다릅니다. 대인 관계와 어떻게해야합니까?,"안녕하세요, 원래 포스터; 대학의 기숙사는 수업에 따라 수업에 의해 관리되지 않습니다.따라서 모든 사람은 다릅니다.선택 과정과 함께 각 수업에는 시간이 다르므로 공통 학습 주제가 없습니다.룸메이트와 좋은 관계를 유지할 수 있다는 것은 대학 생활에 도움이됩니다.당신은 그들을 적극적으로 도와야하며 때로는 그들이 당신을 도와야하며, 시간을 도울 것입니다.당신은 또한 그들과 함께 일반적인 주제에 대해 이야기 할 수 있습니다. 소년들은 게임과 스포츠에 대해 이야기하고, 소녀들은 화장품과 별에 대해 이야기합니다.우리 모두는 우리의 대학 생활과 같은 것이기를 희망합니다 .——— 20은 그와 비슷합니다. 같은 룸메이트가있는 그룹이 있지만 문제는 자신의 감정에 대한 모든 사람의 견해가 다르다는 것입니다. 당신은 다른 사람들과 다른 사람들로 간주합니다. 반드시 그런 것은 아닙니다. 친구로 데려가십시오.집주인은 독립적이어야한다고 생각합니다. 결국, 대학의 우정은 강력하고 강하며 깨지기 쉽고 깨지기 쉽습니다.당신은 더 이상 당신을 무시하고, 더 많은 관심을 썼으며, 당신이 좋아하는 사람들을 향상시키기 위해 더 열심히 노력하는 사람들 앞에서 존재감을 찾을 필요가 없습니다.의식은 여전히 ​​존재하고, 태도가 가까워지고, 다른 곳에서 생각하고 마음을 비교하는 법을 배워야하지만, 허용 할 수없는 요청에 직면하면 집주인은 대담하게 거절해야합니다.",6 개의 기숙사가 있으며 수업 시간은 다릅니다. 대인 관계와 어떻게해야합니까?,O
4477,"2 학년, 항상 학교 식당에 라이스 카드를 던지고, 물건을 잃는 나쁜 문제를 어떻게 바꾸는가?이 문제를 보았을 때, 나는 학교에있을 때 종종 식사 카드를 잊어 버리는 열쇠를 잃어 버렸다는 것을 알았습니다. 사실, 이것은 정상입니다. 여기에서 작은 제안을 할 수 있습니다.라이스 카드와 같은 ""작은 것""은 키에 묶을 수있는 라이스 카드 덮개를 구입할 수 있으므로 매일 열쇠를 가져와 매일 사용하는 것을 기억하면됩니다. 침대 옆에 하나 또는 두 개의 저장 상자를 넣거나 두는 것입니다. 침대 옆에 보관에 잘 사용되지 않은 두 가지.이 장소에서 고정하여 찾을 수 있습니다. yo.","2 학년, 항상 학교 식당에 라이스 카드를 던지고, 물건을 잃는 나쁜 문제를 어떻게 바꾸는가?","이 문제를 보았을 때, 나는 학교에있을 때 종종 식사 카드를 잊어 버리는 열쇠를 잃어 버렸다는 것을 알았습니다. 사실, 이것은 정상입니다. 여기에서 작은 제안을 할 수 있습니다.라이스 카드와 같은 ""작은 것""은 키에 묶을 수있는 라이스 카드 덮개를 구입할 수 있으므로 매일 열쇠를 가져와 매일 사용하는 것을 기억하면됩니다. 침대 옆에 하나 또는 두 개의 저장 상자를 넣거나 두는 것입니다. 침대 옆에 보관에 잘 사용되지 않은 두 가지.이 장소에서 고정하여 찾을 수 있습니다. yo.","2 학년, 항상 학교 식당에 라이스 카드를 던지고, 물건을 잃는 나쁜 문제를 어떻게 바꾸는가?",O
4478,"20 명의 남자, 어떻게 든 항상 불안합니다. 항상 기분이 어떨까요?안녕하세요, 여러 번 사람들은 전, 인터뷰 전, 연설 전 또는 보고서 이전과 같은 불안을 느낄 수 있습니다. 불안 경험이 정상적인 수준이면 정상입니다.장기적인 과도한 불안은 불안의 번식으로 이어질 수 있습니다.불안은 신경증에서 흔한 일입니다. 주요 특성은 불안과 정서적 경험이 특징이며, 이는 광범위한 불안과 급성 불안으로 나눌 수 있습니다.개인적으로 신체에 땀을 흘리며, 얼굴을 홍조, 호흡 곤란, 두근 두근, 위장 불편, 근육 긴장 등으로 강제적 인 사고, 과도한 생각 및 불안으로 나타납니다.피험자가 제공 한 정보가 너무 적은 것은 대상의 현재 특정 상황을 결정하기에 충분하지 않습니다. 진단 후 전문 병원을 얻는 데 관련 진단도 권장됩니다.주제에 의해 제공된 일부 정보와 결합하여 소유자 자신이 불안의 이유와 대상을 알지 못한다는 것입니다. 그러면 심리적 분류의 광범위한 불안과 비슷합니다.이 상태는 오랜 역사를 가지고 있다면, 그런 다음 필요로하는 경우 불안의 가능성을 고려해야합니다.심리 카운슬러 또는 관련 상위 3 개 병원을위한 심리적 카운슬러 또는 심리적 외래 환자 클리닉을 찾는 것이 좋습니다.불안의 경우, 자기 예약은 다음과 같은 제안을 언급 할 수 있습니다. 자기 컨퍼런스 증가 : 자신감이없는 사람들은 자신의 능력에 대해 의심스럽고 실패의 가능성을 과장 할 것입니다. 예를 들어 ""나는 더 나아질 수 없습니다"". 나는 ""자기 반성 : 일부 신경 학적 불안은 잠재 의식에 대한 특정 감정과 우울증에 대한 우울증 때문입니다.이 경우, 자기 반성을 수행하고 그 이유를 찾아야합니다.자기 최면 : 대부분의 불안 사람들은 수면 장애가 있거나, 잠들기가 어렵거나, 갑자기 꿈에서 일어나기가 어렵습니다. 당신은 자기 위안의 힌트를 만들거나, 진정시키는 음악이나지도를 듣고 자신이 잠들 수 있도록 도와 줄 수 있습니다.마지막으로, 오랫동안 불안한 사람들에게는 약물 치료가 좋은지, 심리적 상담을 성장시키지 않아야하는지 신중하게 치료해야합니다.","20 명의 남자, 어떻게 든 항상 불안합니다. 항상 기분이 어떨까요?","안녕하세요, 여러 번 사람들은 전, 인터뷰 전, 연설 전 또는 보고서 이전과 같은 불안을 느낄 수 있습니다. 불안 경험이 정상적인 수준이면 정상입니다.장기적인 과도한 불안은 불안의 번식으로 이어질 수 있습니다.불안은 신경증에서 흔한 일입니다. 주요 특성은 불안과 정서적 경험이 특징이며, 이는 광범위한 불안과 급성 불안으로 나눌 수 있습니다.개인적으로 신체에 땀을 흘리며, 얼굴을 홍조, 호흡 곤란, 두근 두근, 위장 불편, 근육 긴장 등으로 강제적 인 사고, 과도한 생각 및 불안으로 나타납니다.피험자가 제공 한 정보가 너무 적은 것은 대상의 현재 특정 상황을 결정하기에 충분하지 않습니다. 진단 후 전문 병원을 얻는 데 관련 진단도 권장됩니다.주제에 의해 제공된 일부 정보와 결합하여 소유자 자신이 불안의 이유와 대상을 알지 못한다는 것입니다. 그러면 심리적 분류의 광범위한 불안과 비슷합니다.이 상태는 오랜 역사를 가지고 있다면, 그런 다음 필요로하는 경우 불안의 가능성을 고려해야합니다.심리 카운슬러 또는 관련 상위 3 개 병원을위한 심리적 카운슬러 또는 심리적 외래 환자 클리닉을 찾는 것이 좋습니다.불안의 경우, 자기 예약은 다음과 같은 제안을 언급 할 수 있습니다. 자기 컨퍼런스 증가 : 자신감이없는 사람들은 자신의 능력에 대해 의심스럽고 실패의 가능성을 과장 할 것입니다. 예를 들어 ""나는 더 나아질 수 없습니다"". 나는 ""자기 반성 : 일부 신경 학적 불안은 잠재 의식에 대한 특정 감정과 우울증에 대한 우울증 때문입니다.이 경우, 자기 반성을 수행하고 그 이유를 찾아야합니다.자기 최면 : 대부분의 불안 사람들은 수면 장애가 있거나, 잠들기가 어렵거나, 갑자기 꿈에서 일어나기가 어렵습니다. 당신은 자기 위안의 힌트를 만들거나, 진정시키는 음악이나지도를 듣고 자신이 잠들 수 있도록 도와 줄 수 있습니다.마지막으로, 오랫동안 불안한 사람들에게는 약물 치료가 좋은지, 심리적 상담을 성장시키지 않아야하는지 신중하게 치료해야합니다.","20 명의 남자, 어떻게 든 항상 불안합니다. 항상 기분이 어떨까요?",O
4479,pass,나는 실패가 매우 두려워서 조치를 취하지 않습니다.이 아이디어는 어떻게 바뀔 수 있습니까?,"실패에 대한 두려움, 문제가 없습니다.문제는 당신이 당신의 두려움에 매우 저항력이 있다는 것입니다.당신은 자신의 생각에 매우 저항합니다.즉, 당신은 당신의 생각을 매우 많이 받아들입니다. 당신이 실패 할 것이라고 생각할 때, 당신은 실제로 실패합니다.그러나 당신의 반응은 이런 일이 일어 났으며, 전체 사람은 불안과 두려움의 상태에 있습니다.우리는 두 세계에 살고 하나는 물리적 세계이고 다른 하나는 심리적 세계입니다.물리적 세계는 실제로 매우 간단합니다. 지금 일어난 일은 당신이 책을 읽을 것이라는 것입니다.당신의 내면에서, 당신은 매우 무서운 음모를 상상합니다.현재, 당신은 모든 아이디어에 매료 될 것이므로이 아이디어에는 너무 강력합니다.이 아이디어가 현실이 될 것이 너무 두려워요.그래서 어떻게 당신의 생각이 사라지도록 당신의 모든 힘을 가해.그러나 인간의 마음은 매우 흥미롭고 마음에는 감소와 분열이 없습니다. 추가적인 방법과 곱셈이 있습니다.다시 말해, 한 생각에 더주의를 기울일수록 그를 제거 할 방법이 없으며, 그는 증가하거나 두 배로 만날 것입니다.나는 또한이 아이디어를 재생하고 싶다.현재 우리는 현실과 상상력을 구별해야합니다.현실 세계는 현재 책을 읽어야한다는 것입니다. 물리적 세계의 목적을 만족시키기 위해 무엇을 할 수 있습니까?어떤 것을 먼저 볼 계획입니까?어떤 종류의 방법을 사용할 계획입니까?그리고 당신의 모든 관심은 당신의 심리학과 상상력에 있습니다.당신은 여전히 ​​당신의 상상력이 현실이 될까봐 두려워서, 당신은 당신의 생각을 통제하고 싶지만, 현재 당신은 현실 세계에서 아무것도하지 않았습니다. 당신은 책을 읽지 않으면 실패의 확률이 높아질 것입니다. .그렇기 때문에 더 두려워할수록 실패하기가 더 쉬워집니다.당신이 두려워 할 때, 당신의 힘은 성공하는 방법이 아니라 당신의 마음과 싸우는 방법이기 때문입니다.마음은 마음이고, 아이디어는 단지 아이디어 일뿐입니다. 그것은 사실이 아닙니다.당신은 그를 거기에 존재하게 할 수 있습니다. 당신은 말을 들었습니다.또는 내가 끔찍한 생각을 가지고 있다는 것을 알았고, 나는 내가 실패 할 것이라고 느꼈다는 생각이 있었다. 이때, 당신은 당신의 생각과 일정한 거리를 열었고, 당신은 동의하는 것처럼 당신의 마음과 함께 가지 않을 것입니다.당신은 그가 물리적 세계에서 한 일에 의해 사람의 성공이 무엇인지 알아야하며, 그의 생각으로 달성되었습니다.당신의 생각에서 당신의 에너지를 가져 와서 현재, 당신이 할 수있는 일에 초점을 맞추십시오.",나는 실패가 매우 두려워서 조치를 취하지 않습니다.이 아이디어는 어떻게 바뀔 수 있습니까?,O
4480,"헤어진 후, 나는 자살 경향이 매우 불편하다고 생각했지만, 복합 분해 후 복합이 합리적인지 여부는 서로의 문제가 해결되었는지 여부와 미래에 신뢰를 쌓을 수 있는지에 달려 있습니다.이전의 감정에서, 주제는 상대방을 여러 번 속이는 몇 가지 행동을 가졌습니다. 우리는 그것을 생각할 수 없었습니다. 우리는 상대방이 온화한 성격을 가진 사람이자 온화한 사람이라는 것을 알고 있습니다. 나는 할 것입니다. 평생 동안 죄책감을 느낍니다.그러므로 우리는 인생이 농담이 아니라는 것을 이해해야합니다. 이것은 최소한의 결론입니다. 사람이 인생을 소중히 여기지 않는다면 어떻게 다른 사람들을 소중히 할 수 있습니까?기본적인 신뢰도도 있습니다. 게임 레크리에이션을하는 것은 허용되지만, 상대방에게 바쁘다고 말했고 상대방이 발견했으며, 그녀가 여전히 우리를 돌보고 있음을 나타내지 만 우리가 변명을 사용한다는 것을 알고 있습니다. 상대방을 피하십시오. 그녀는 속임수를 썼습니다. 사실 그녀는 우리에게 아무것도하지 말라고 요청하지는 않았지만 우리가 그녀에게 거짓말을하기를 원하지 않았습니다.앞으로, 화합물을 만들 수있는 기회는 여전히 미래에 교차로가 있을지 여부에 달려 있습니다. 소유자는 상대방이 미래에 해외에 갈 수 있다고 말했고 우리는이 조건을 가져서는 안된다고 말했습니다.상대방이 해외로 가면,이 관계는 아마도 바람과 함께 갈 것입니다. 결국, 크로스 버더 사랑은 여전히 ​​어려운 일입니다. 특히 현재 상황에서는 서로에 대한 주장이 많지 않습니다.상대방이 머무르기로 선택한다면, 우리는 주제가 먼저 더 나아 졌다고 말하면서, 당신이 연인이되지 않더라도 친구가 될 수 있습니다. 사랑은 때때로 소유하지 않지만 희망을 상대방이 행복하게 살 수 있습니다.세상은 당신을 사랑합니다.","헤어진 후, 나는 매우 불편하다고 느끼는 자살 경향에 얽혀 있었지만 재결합하고 싶습니다.","헤어진 후 여부는 서로의 문제가 해결되었는지 여부와 미래에 신뢰를 쌓을 수 있는지 여부에 달려 있습니다.이전의 감정에서, 주제는 상대방을 여러 번 속이는 몇 가지 행동을 가졌습니다. 우리는 그것을 생각할 수 없었습니다. 우리는 상대방이 온화한 성격을 가진 사람이자 온화한 사람이라는 것을 알고 있습니다. 나는 할 것입니다. 평생 동안 죄책감을 느낍니다.그러므로 우리는 인생이 농담이 아니라는 것을 이해해야합니다. 이것은 최소한의 결론입니다. 사람이 인생을 소중히 여기지 않는다면 어떻게 다른 사람들을 소중히 할 수 있습니까?기본적인 신뢰도도 있습니다. 게임 레크리에이션을하는 것은 허용되지만, 상대방에게 바쁘다고 말했고 상대방이 발견했으며, 그녀가 여전히 우리를 돌보고 있음을 나타내지 만 우리가 변명을 사용한다는 것을 알고 있습니다. 상대방을 피하십시오. 그녀는 속임수를 썼습니다. 사실 그녀는 우리에게 아무것도하지 말라고 요청하지는 않았지만 우리가 그녀에게 거짓말을하기를 원하지 않았습니다.앞으로, 화합물을 만들 수있는 기회는 여전히 미래에 교차로가 있을지 여부에 달려 있습니다. 소유자는 상대방이 미래에 해외에 갈 수 있다고 말했고 우리는이 조건을 가져서는 안된다고 말했습니다.상대방이 해외로 가면,이 관계는 아마도 바람과 함께 갈 것입니다. 결국, 크로스 버더 사랑은 여전히 ​​어려운 일입니다. 특히 현재 상황에서는 서로에 대한 주장이 많지 않습니다.상대방이 머무르기로 선택한다면, 우리는 주제가 먼저 더 나아 졌다고 말하면서, 당신이 연인이되지 않더라도 친구가 될 수 있습니다. 사랑은 때때로 소유하지 않지만 희망을 상대방이 행복하게 살 수 있습니다.세상은 당신을 사랑합니다.","헤어진 후, 나는 매우 불편하다고 느끼는 자살 경향에 얽혀 있었지만 재결합하고 싶습니다.",O
4481,"감정적 인 것이 너무 많아서는 안된다고합니다. 실제로 지각 지식을 차단해야합니까?안녕하세요, 감정적 인 사람들은 원래 감정적 인 동물이거나 사람들의 자연 속성은 매우 길다.사회가 끝나고, 더 잘 살아남 으려고, 다양한 사회적 규칙이 나타 났으며 사람들은 나카노의 자연 속성의 일부를 점차적으로 규제합니다. 지배 계급의 이익을 만족시킵니다.최근 오디오 레슨을 듣고,이 부분에 대해 이야기하고, 공유 : 1. 서구 사회 또는 자본주의 사회는 첫 번째 규칙입니다. 성숙한 사람의 로고는 독립적이거나 사회적 규칙을 준수하거나 그럴 수 있습니다. 우리 중 많은 사람들이 이제 많은 사람들이 이제 많은 사람들이 추구, 물질, 지위, 명예 등의 성공을 거두었다고 말했습니다.그러나 성인은 규칙의 표준에주의를 기울입니다.사람들 사이의 감정은 고립되고 합리적입니다.2. 중국과 마찬가지로 동부 사회는 인간의 감정에주의를 기울이고 있습니다. 성숙한 사람은 사회와 가족의 조화 위치를 가져야합니다. 가정은 우정에 대해 이야기 할 수있는 곳입니다. 따라서 중국인은 들어가서 출구가 될 수 있습니다. 성공할 수 있습니다. .3. 그 이유는 더 좋거나 더 관능적이며 절대 표준이 없으며 가장 큰 기준은 편안하기 때문입니다.여기서 나는 원래 포스터에 ""eq""를 소개합니다. 그것은 감정적이고 합리적인 질문에 관한 것입니다. 나는 그것이 집주인에게 대답 할 수 있다고 생각합니다.아래의 일부 견해에 대해 간단히 이야기 해 봅시다 : 생리 학적 기능에서 뇌의 아몬드 코어는 분위기가 담당하는 곳입니다. 인간의 뇌에는 아몬드 코어에 도달 할 두 개의 도로가 있습니다. 전두엽 엽 피질은 장소입니다. 생각을 위해.전두엽 피질에 도달 한 뉴런을 통한 우리의 아이디어 중 하나는 치료를 선택한 다음 아몬드 핵으로 감정을 표현했습니다.이 과정은 합리적으로 처리되었으며 중요한 결정이나 사물을 다루는 것이 더 적합합니다.또한 정보를 받고 아몬드 코어를 직접 달성하는 작은 도로가 있습니다.이 도로는 접근 방식에 속합니다. 합리적 사고의 대우가 없으면 자신의 감정을 직접 표현합니다. 더 독창적입니다.마치 어떤 사람들이 감정을 맹렬히 표현하는 것처럼, 기본적으로 길을 따릅니다.이러한 감정은 합리성이 부족한 것은 비교적 감정적입니다.이것은 지진과 같은 비상 사태에 더 적합하며 즉시 탈출했습니다.그러므로 관능과 합리성은 특정 생리 학적 근거를 가지고 있으며 부모님의 부모에게 감정을 얻은 방법이 있습니다.",감정적 인 것이 너무 많아서는 안된다고합니다. 실제로 지각 지식을 차단해야합니까?,"안녕하세요, 감정적 인 사람들은 원래 감정적 인 동물이거나 사람들의 자연 속성은 매우 길다.사회가 끝나고, 더 잘 살아남 으려고, 다양한 사회적 규칙이 나타 났으며 사람들은 나카노의 자연 속성의 일부를 점차적으로 규제합니다. 지배 계급의 이익을 만족시킵니다.최근 오디오 레슨을 듣고,이 부분에 대해 이야기하고, 공유 : 1. 서구 사회 또는 자본주의 사회는 첫 번째 규칙입니다. 성숙한 사람의 로고는 독립적이거나 사회적 규칙을 준수하거나 그럴 수 있습니다. 우리 중 많은 사람들이 이제 많은 사람들이 이제 많은 사람들이 추구, 물질, 지위, 명예 등의 성공을 거두었다고 말했습니다.그러나 성인은 규칙의 표준에주의를 기울입니다.사람들 사이의 감정은 고립되고 합리적입니다.2. 중국과 마찬가지로 동부 사회는 인간의 감정에주의를 기울이고 있습니다. 성숙한 사람은 사회와 가족의 조화 위치를 가져야합니다. 가정은 우정에 대해 이야기 할 수있는 곳입니다. 따라서 중국인은 들어가서 출구가 될 수 있습니다. 성공할 수 있습니다. .3. 그 이유는 더 좋거나 더 관능적이며 절대 표준이 없으며 가장 큰 기준은 편안하기 때문입니다.여기서 나는 원래 포스터에 ""eq""를 소개합니다. 그것은 감정적이고 합리적인 질문에 관한 것입니다. 나는 그것이 집주인에게 대답 할 수 있다고 생각합니다.아래의 일부 견해에 대해 간단히 이야기 해 봅시다 : 생리 학적 기능에서 뇌의 아몬드 코어는 분위기가 담당하는 곳입니다. 인간의 뇌에는 아몬드 코어에 도달 할 두 개의 도로가 있습니다. 전두엽 엽 피질은 장소입니다. 생각을 위해.전두엽 피질에 도달 한 뉴런을 통한 우리의 아이디어 중 하나는 치료를 선택한 다음 아몬드 핵으로 감정을 표현했습니다.이 과정은 합리적으로 처리되었으며 중요한 결정이나 사물을 다루는 것이 더 적합합니다.또한 정보를 받고 아몬드 코어를 직접 달성하는 작은 도로가 있습니다.이 도로는 접근 방식에 속합니다. 합리적 사고의 대우가 없으면 자신의 감정을 직접 표현합니다. 더 독창적입니다.마치 어떤 사람들이 감정을 맹렬히 표현하는 것처럼, 기본적으로 길을 따릅니다.이러한 감정은 합리성이 부족한 것은 비교적 감정적입니다.이것은 지진과 같은 비상 사태에 더 적합하며 즉시 탈출했습니다.그러므로 관능과 합리성은 특정 생리 학적 근거를 가지고 있으며 부모님의 부모에게 감정을 얻은 방법이 있습니다.",감정적 인 것이 너무 많아서는 안된다고합니다. 실제로 지각 지식을 차단해야합니까?,O
