raw_url,context,raw_question,raw_answer,annotated_question,is_impossible
4421,"벌거 벗은 사임 후에 만족스러운 직업을 찾지 못하면 어떻게해야합니까? 나는 사람들과 의사 소통하고 싶지 않습니까?불안의 구호 방법에는 다음이 포함됩니다. 1. 적절한 휴식 훈련 : 전문 의사 또는 심리적 카운슬러의지도하에 호흡이나 신체 훈련을 휴식을 취할 수 있습니다. 예를 들어, 명상 심호흡은 신체 운동을 수행 할 수 있습니다. 또는 리듬 연구 : 올바른 리듬은 불안을 줄이는 데 도움이됩니다. 작업과 휴식 공식 계획 3. 문제에 대한 응답 능력 향상 : 불안의 원천은 일반적으로 어려움을 겪거나 해결할 수 없습니다. 사물을 볼 수있는 긍정적 인 태도를 취하십시오. 어떤 사람들은 생각하기가 어렵지 않습니다. 자기 분야에서 엄격함을 추구하지 않는 것은 좋은 일이지만 다른 사람들에게도 좋은 인상을 남길 수 있습니다.당신이 적절할 때, ""자신을 대""하고 자신과 화해하는 법을 배우십시오.부적절한 것은 일종의 진실입니다. 그것은 또한 다른 사람들에게 존중 될 수 있으며 매일 그들이 할 수있는 일을 조사하고 확인하기 위해 자신의 작은 성공을 인식 할 수 있습니다.예를 들어, ""오늘 제 시간에 올라 오는 것"", ""오늘은 활력으로 가득 찬 일을 할 수 있습니다"", 매일 자기 자신을 찾으십시오. 손에있는 물건을 다룰 때 단계별로 자신의 요구를 찾으십시오. , 중요하고 2 차 과정을 먼저하고, 큰 어려움을 작은 과정으로 바꾸어 원래 포스터를 깨고, 자신의 삶의 리듬을 바꾸려고 노력하십시오. 열심히 노력하고, 노력하고, 매일 진전을 이루십시오.",벌거 벗은 사임 후에 만족스러운 직업을 찾지 못하면 어떻게해야합니까? 나는 사람들과 의사 소통하고 싶지 않습니까?,"불안의 구호 방법에는 다음이 포함됩니다. 1. 적절한 휴식 훈련 : 전문 의사 또는 심리적 카운슬러의지도하에 호흡이나 신체 훈련을 휴식을 취할 수 있습니다. 예를 들어, 명상 심호흡은 신체 운동을 수행 할 수 있습니다. 또는 리듬 연구 : 올바른 리듬은 불안을 줄이는 데 도움이됩니다. 작업과 휴식 공식 계획 3. 문제에 대한 응답 능력 향상 : 불안의 원천은 일반적으로 어려움을 겪거나 해결할 수 없습니다. 사물을 볼 수있는 긍정적 인 태도를 취하십시오. 어떤 사람들은 생각하기가 어렵지 않습니다. 자기 분야에서 엄격함을 추구하지 않는 것은 좋은 일이지만 다른 사람들에게도 좋은 인상을 남길 수 있습니다.당신이 적절할 때, ""자신을 대""하고 자신과 화해하는 법을 배우십시오.부적절한 것은 일종의 진실입니다. 그것은 또한 다른 사람들에게 존중 될 수 있으며 매일 그들이 할 수있는 일을 조사하고 확인하기 위해 자신의 작은 성공을 인식 할 수 있습니다.예를 들어, ""오늘 제 시간에 올라 오는 것"", ""오늘은 활력으로 가득 찬 일을 할 수 있습니다"", 매일 자기 자신을 찾으십시오. 손에있는 물건을 다룰 때 단계별로 자신의 요구를 찾으십시오. , 중요하고 2 차 과정을 먼저하고, 큰 어려움을 작은 과정으로 바꾸어 원래 포스터를 깨고, 자신의 삶의 리듬을 바꾸려고 노력하십시오. 열심히 노력하고, 노력하고, 매일 진전을 이루십시오.",벌거 벗은 사임 후에 만족스러운 직업을 찾지 못하면 어떻게해야합니까? 나는 사람들과 의사 소통하고 싶지 않습니까?,O
4422,"일과 휴식으로 인해 룸메이트와의 충돌로 어떻게해야합니까?~~ 당신이 최근에 만난 곤경을 보니 죄송합니다, 당신을 안아주세요 ~ 나는 침실에서 룸메이트에 대한 당신의 설명을 보았습니다. 나는 그녀를 만지지 않았지만 그녀에 대해 많이 모르지만 정말 느낍니다. 그녀는 조금 조금 조금 있습니다. 자기 중심적으로, 당신은 상호 존중의 원리를 배우지 않을 수 있으므로 다른 룸메이트, 즉 많은 나쁜 감정을 가져다주고, 침실 생활을 불편하게 만들고, 상황에 동정심을 나타냅니다. .당신의 설명을 읽은 후, 나는 당신과 룸메이트가 일어나기시기에 다르다는 것을 알았습니다. 이것은 많은 대학 침실에서 일반적인 문제입니다. 생활과 휴식에 대해이 문제를 해결하기가 어렵습니다.그러나 나는 당신의 모든 문제 에서이 문제가 주로 당신이 그녀로 이사했기 때문에 가장 두드러진 것이라고 생각하지만, 그녀는 당신을 이해하지 못했습니다. 나는 당신이 그녀의 싸움 때문에 큰 싸움을했다고 말했습니다. 그것에 대해 얘기?아니면 감정이 너무 흥분하기 때문입니까?어쩌면 당신은 그녀에게 당신의 진정한 생각을 말하려고 시도 할 수 있습니다. 예를 들어, 당신은 ""우리는 당신과 싸우고 싶지는 않지만 방 공간이 너무 작기 때문에 우리가 무언가를 만나는 것은 불가피합니다. 침실로 가득 차 있습니다.하지만 잠자리에 들기 전에 우리에게 말해 줄 수 있기를 바랍니다. 우리는 준비 될 것입니다. ""나는 마지막 문장을 읽었습니다.""우리는 현재 서로 말하지 않았습니다. "" , 여전히 싸움없이 문제를 해결하는 것이 좋습니다.",일과 휴식으로 인해 룸메이트와의 충돌로 어떻게해야합니까?,"~~ 당신이 최근에 만난 곤경을 보니 죄송합니다, 당신을 안아주세요 ~ 나는 침실에서 룸메이트에 대한 당신의 설명을 보았습니다. 나는 그녀를 만지지 않았지만 그녀에 대해 많이 모르지만 정말 느낍니다. 그녀는 조금 조금 조금 있습니다. 자기 중심적으로, 당신은 상호 존중의 원리를 배우지 않을 수 있으므로 다른 룸메이트, 즉 많은 나쁜 감정을 가져다주고, 침실 생활을 불편하게 만들고, 상황에 동정심을 나타냅니다. .당신의 설명을 읽은 후, 나는 당신과 룸메이트가 일어나기시기에 다르다는 것을 알았습니다. 이것은 많은 대학 침실에서 일반적인 문제입니다. 생활과 휴식에 대해이 문제를 해결하기가 어렵습니다.그러나 나는 당신의 모든 문제 에서이 문제가 주로 당신이 그녀로 이사했기 때문에 가장 두드러진 것이라고 생각하지만, 그녀는 당신을 이해하지 못했습니다. 나는 당신이 그녀의 싸움 때문에 큰 싸움을했다고 말했습니다. 그것에 대해 얘기?아니면 감정이 너무 흥분하기 때문입니까?어쩌면 당신은 그녀에게 당신의 진정한 생각을 말하려고 시도 할 수 있습니다. 예를 들어, 당신은 ""우리는 당신과 싸우고 싶지는 않지만 방 공간이 너무 작기 때문에 우리가 무언가를 만나는 것은 불가피합니다. 침실로 가득 차 있습니다.하지만 잠자리에 들기 전에 우리에게 말해 줄 수 있기를 바랍니다. 우리는 준비 될 것입니다. ""나는 마지막 문장을 읽었습니다.""우리는 현재 서로 말하지 않았습니다. "" , 여전히 싸움없이 문제를 해결하는 것이 좋습니다.",일과 휴식으로 인해 룸메이트와의 충돌로 어떻게해야합니까?,O
4423,"나는 사람들을 꼬집고 나 자신을 진정시키는 방법을 의심하고 싶습니까?~~ 최근에 당신이 나쁜 상태가 좋지 않아서 죄송합니다, 당신을 안아주십시오 ~ 당신은 때때로 당신이 감정을 통제하는 데 어려움이 있다는 것을 알 수 있습니다. 통풍구가 자신과 다른 사람들을 이해하고 상처를 입기 어려울 수 있습니다. 동정심, 당신은 자신의 나쁜 상태에 의해 혼란스러워합니다.당신의 설명에 따르면, ""나는 사람들을 꼬집고 응답하고 싶다""고 말하고 다른 사람들에게 이해하고, 그를 때리거나 듣지 않고 그를 꾸짖고 싶어한다.당신이 당신의 상태가 자녀와 특히 비슷하다는 것을 알지 못하는지 모르겠습니다. 자녀의 상태를 관찰했는지 모르겠습니다. 아이가 만족하지 않으면 Sisduri의 행동을 사용하여 부모님의 관심을 끌거나 주변 사람들의 관심을 끌기위한 부모.어린 시절의 경험에서 그 이유를 찾을 수있을 것 같아요. 지금은 당신의 나이를 본 후에도 여전히 이것을 느낄 것입니다. 그러면이 문제는 오랫동안 당신을 괴롭 혔을 것입니다. 그것?부모님의 마지막 부분은 부모님의 모범이라는 것을 알았습니다. 아버지와 어머니의 행동은 당신이 무력감을 느끼게하는 것처럼 보였습니다. 당신은 그들에게 그다지 만족하지 않기 때문에 이것이 당신의 원주민 가족과 관련이 있어야한다고 생각합니다. 가족의 어린이에 대한 영향은 매우 크다. 나는 많은 행동이 부모의 영향과 관련이 있다고 생각한다.이 문제를 해결하는 방법은 이전 가족과 자신과 화해 할 수 있습니다. 만약 당신이 혼자 할 수 없다고 생각한다면, 친구 나 전문 심리 상담 교사 나 심리학자와 같은 외부 도움을 구할 수 있습니다. 수용과 메이크업.",나는 사람들을 꼬집고 나 자신을 진정시키는 방법을 의심하고 싶습니까?,"~~ 최근에 당신이 나쁜 상태가 좋지 않아서 죄송합니다, 당신을 안아주십시오 ~ 당신은 때때로 당신이 감정을 통제하는 데 어려움이 있다는 것을 알 수 있습니다. 통풍구가 자신과 다른 사람들을 이해하고 상처를 입기 어려울 수 있습니다. 동정심, 당신은 자신의 나쁜 상태에 의해 혼란스러워합니다.당신의 설명에 따르면, ""나는 사람들을 꼬집고 응답하고 싶다""고 말하고 다른 사람들에게 이해하고, 그를 때리거나 듣지 않고 그를 꾸짖고 싶어한다.당신이 당신의 상태가 자녀와 특히 비슷하다는 것을 알지 못하는지 모르겠습니다. 자녀의 상태를 관찰했는지 모르겠습니다. 아이가 만족하지 않으면 Sisduri의 행동을 사용하여 부모님의 관심을 끌거나 주변 사람들의 관심을 끌기위한 부모.어린 시절의 경험에서 그 이유를 찾을 수있을 것 같아요. 지금은 당신의 나이를 본 후에도 여전히 이것을 느낄 것입니다. 그러면이 문제는 오랫동안 당신을 괴롭 혔을 것입니다. 그것?부모님의 마지막 부분은 부모님의 모범이라는 것을 알았습니다. 아버지와 어머니의 행동은 당신이 무력감을 느끼게하는 것처럼 보였습니다. 당신은 그들에게 그다지 만족하지 않기 때문에 이것이 당신의 원주민 가족과 관련이 있어야한다고 생각합니다. 가족의 어린이에 대한 영향은 매우 크다. 나는 많은 행동이 부모의 영향과 관련이 있다고 생각한다.이 문제를 해결하는 방법은 이전 가족과 자신과 화해 할 수 있습니다. 만약 당신이 혼자 할 수 없다고 생각한다면, 친구 나 전문 심리 상담 교사 나 심리학자와 같은 외부 도움을 구할 수 있습니다. 수용과 메이크업.",나는 사람들을 꼬집고 나 자신을 진정시키는 방법을 의심하고 싶습니까?,O
4424,"낮에는 슬프고 밤에는 행복하고 이상합니다. 불면증이 있다면 어떻게해야합니까?~~ 위의 다양한 분야의 숙제 나 업무에서 많은 일을하는 것과 같이 하루 종일 많은 것들이 있기 때문일 수 있습니다. 당신은 많은 압력이 있고 오늘날 많은 실수에 대해 걱정합니다.——- 사람들이 많을수록 의심스럽고 불안합니다.다음 과제에 직면 할 자신감이 없다고 생각하며 실수를 저지르는 것에 대해 걱정할 것입니다.낮에는 어제 밤에 잘 자지 않았기 때문에 다음날 일어나서 특히 지쳐 질 것이며 스트레스에 영향을받을 가능성이 더 높습니다.잠을 자면 행복한 것들이 너무 행복하지 않습니다............. 당신이 마침내 배우거나 일하는 문제를 해결하기 때문에 밤에 행복합니다. 밤에는 행복한 시간을 편안하게 살 수 있습니다. 따뜻하고 편안한 집으로 돌아가서, 당신은 직접 날 수 있습니다. 침대에서 조용히.복잡한 대인 관계 대인 관계 커뮤니케이션을 배우기 위해 복잡한 숙제에 직면 할 필요는 없습니다. 좋은 휴식을 취하고 좋아하는 TV 시리즈를보고 모바일 게임을 할 수 있습니다.모든 사람은 생물학적 시계를 가지고 있고, 늦은 밤에 머물고, 가장 쉬운 잠을 자고, 닭 피의 피를 치고 싶고, 당신은 마음의 평화로 멈추고 잠을 잘 수 없습니다.따라서 좋은 일정을 개발하는 것은 신체에 특히 중요하며 다양한 운동에 참여하면 더 쉽게 잠을 잘 수 있습니다.요컨대, 다음 날이 충분한 지 확인하려면 일찍 잠자리에 들기를해야합니다.당신이 용기를 가질 때, 나는 다음날 도전에 직면 할 수 있습니다. 나는 당신이 그렇게 염려하고 혼란 스러울 것이라고 믿습니다.",낮에는 슬프고 밤에는 행복하고 이상합니다. 불면증이 있다면 어떻게해야합니까?,"~~ 위의 다양한 분야의 숙제 나 업무에서 많은 일을하는 것과 같이 하루 종일 많은 것들이 있기 때문일 수 있습니다. 당신은 많은 압력이 있고 오늘날 많은 실수에 대해 걱정합니다.——- 사람들이 많을수록 의심스럽고 불안합니다.다음 과제에 직면 할 자신감이 없다고 생각하며 실수를 저지르는 것에 대해 걱정할 것입니다.낮에는 어제 밤에 잘 자지 않았기 때문에 다음날 일어나서 특히 지쳐 질 것이며 스트레스에 영향을받을 가능성이 더 높습니다.잠을 자면 행복한 것들이 너무 행복하지 않습니다............. 당신이 마침내 배우거나 일하는 문제를 해결하기 때문에 밤에 행복합니다. 밤에는 행복한 시간을 편안하게 살 수 있습니다. 따뜻하고 편안한 집으로 돌아가서, 당신은 직접 날 수 있습니다. 침대에서 조용히.복잡한 대인 관계 대인 관계 커뮤니케이션을 배우기 위해 복잡한 숙제에 직면 할 필요는 없습니다. 좋은 휴식을 취하고 좋아하는 TV 시리즈를보고 모바일 게임을 할 수 있습니다.모든 사람은 생물학적 시계를 가지고 있고, 늦은 밤에 머물고, 가장 쉬운 잠을 자고, 닭 피의 피를 치고 싶고, 당신은 마음의 평화로 멈추고 잠을 잘 수 없습니다.따라서 좋은 일정을 개발하는 것은 신체에 특히 중요하며 다양한 운동에 참여하면 더 쉽게 잠을 잘 수 있습니다.요컨대, 다음 날이 충분한 지 확인하려면 일찍 잠자리에 들기를해야합니다.당신이 용기를 가질 때, 나는 다음날 도전에 직면 할 수 있습니다. 나는 당신이 그렇게 염려하고 혼란 스러울 것이라고 믿습니다.",낮에는 슬프고 밤에는 행복하고 이상합니다. 불면증이 있다면 어떻게해야합니까?,O
4425,"나는 다른 사람들이 자신보다 더 잘 본다. 항상 거부하고 책임을 져 있습니까?안녕하세요, 원래 포스터 ~ 나는 당신의 우울증과 고통을 먼저 느낄 수 있습니다. 집주인에 대한 설명은 항상 자신을 부인했습니다. 당신이 보는 것은 자신의 나쁜면이며 항상 자신을 부정하고 비난하지만 실제로 모든 사람들이 거기에 있습니다. 플래시 포인트이며 모두 아름다운면이 있습니다.친구들은 특히 좋은 친구가 없다고 말하기 위해 호스트에게 가야합니다. 도움이 필요하고 동반 할 때 주변에는 아무도 없습니다. 집주인의 우정에 대한 욕구는 보이지 않지만 관계를 유지하는 데 능숙합니다.그런 다음 집주인은 새로운 친구를 사귀기 위해 주도권을 잡을 수 있습니다. 사실, 모든 관계는 마음과 함께 운영되어야합니다. 친구의 수는 많지 않습니다.자신의 장점을보고, 오리지널 포스터는 항상 자신을 부인하고 자신의 결점을보고, 그는 불행합니다. 모두가 완벽하지 않습니다. 본질자신이기 때문에 각 사람을 다른 사람과 비교할 필요는 없으며, 잘하는 분야는 다릅니다. 항상 우리보다 강력한 사람들이 항상있을 것이지만, 우리는 다른 사람들보다 낫습니다.위의 것보다 적은 말이 있습니다. 항상 다른 사람들과 비교하면 고통을 증가시킬 것입니다.당신이 그것을 비교해야한다면, 우리 자신과 비교해야한다면, 본관은 지속적으로 우리 자신을 향상시키고 자신을 향상시키는 것입니다. 과거에는 자신보다 더 낫습니다. 우리는 모든 사람을 능가 할 수 없습니다. 우리가 할 수있는 것은 과거에 자신을 능가하는 것입니다.집주인이 가능한 한 빨리 문제를 없애고 행복하고 행복한 삶을 살기를 바랍니다 ~.",나는 다른 사람들이 자신보다 더 잘 본다. 항상 거부하고 책임을 져 있습니까?,"안녕하세요, 원래 포스터 ~ 나는 당신의 우울증과 고통을 먼저 느낄 수 있습니다. 집주인에 대한 설명은 항상 자신을 부인했습니다. 당신이 보는 것은 자신의 나쁜면이며 항상 자신을 부정하고 비난하지만 실제로 모든 사람들이 거기에 있습니다. 플래시 포인트이며 모두 아름다운면이 있습니다.친구들은 특히 좋은 친구가 없다고 말하기 위해 호스트에게 가야합니다. 도움이 필요하고 동반 할 때 주변에는 아무도 없습니다. 집주인의 우정에 대한 욕구는 보이지 않지만 관계를 유지하는 데 능숙합니다.그런 다음 집주인은 새로운 친구를 사귀기 위해 주도권을 잡을 수 있습니다. 사실, 모든 관계는 마음과 함께 운영되어야합니다. 친구의 수는 많지 않습니다.자신의 장점을보고, 오리지널 포스터는 항상 자신을 부인하고 자신의 결점을보고, 그는 불행합니다. 모두가 완벽하지 않습니다. 본질자신이기 때문에 각 사람을 다른 사람과 비교할 필요는 없으며, 잘하는 분야는 다릅니다. 항상 우리보다 강력한 사람들이 항상있을 것이지만, 우리는 다른 사람들보다 낫습니다.위의 것보다 적은 말이 있습니다. 항상 다른 사람들과 비교하면 고통을 증가시킬 것입니다.당신이 그것을 비교해야한다면, 우리 자신과 비교해야한다면, 본관은 지속적으로 우리 자신을 향상시키고 자신을 향상시키는 것입니다. 과거에는 자신보다 더 낫습니다. 우리는 모든 사람을 능가 할 수 없습니다. 우리가 할 수있는 것은 과거에 자신을 능가하는 것입니다.집주인이 가능한 한 빨리 문제를 없애고 행복하고 행복한 삶을 살기를 바랍니다 ~.",나는 다른 사람들이 자신보다 더 잘 본다. 항상 거부하고 책임을 져 있습니까?,O
4426,"나는 무슨 말을 해야할지 모르겠다. 눈물이 떨어지고, 너무 고통스럽고, 떠나고 싶니?내 사랑, 좋은 저녁, 잤어?~ 만나기가 어렵습니까?당신이 입력하고 싶지 않고, 말하고 싶지 않으며, 잠시 동안 그것을 조용히 대우하고, 당신 주변의 가장 가까운 친척과 친구들에게 전화를 걸어 당신과 동행하고 싶습니까?나는 당신이 내 대답으로 갈 수 있는지 모르겠다. 모든 사람들이 어두운 날을 마주 할 때 뜨거운 물을 마시면서 내 대답을 보라고 부탁한다. 이 날에 살면서 뒤돌아보십시오. 장수의 순간입니다. 우리가 감정적으로 불안정 할 때 쉽게 결정을 내리지 마십시오!교차로결정을 내리지 마십시오!교차로","나는 무슨 말을 해야할지 모르겠다. 눈물이 떨어지고, 너무 고통스럽고, 떠나고 싶니?","내 사랑, 좋은 저녁, 잤어?~ 만나기가 어렵습니까?당신이 입력하고 싶지 않고, 말하고 싶지 않으며, 잠시 동안 그것을 조용히 대우하고, 당신 주변의 가장 가까운 친척과 친구들에게 전화를 걸어 당신과 동행하고 싶습니까?나는 당신이 내 대답으로 갈 수 있는지 모르겠다. 모든 사람들이 어두운 날을 마주 할 때 뜨거운 물을 마시면서 내 대답을 보라고 부탁한다. 이 날에 살면서 뒤돌아보십시오. 장수의 순간입니다. 우리가 감정적으로 불안정 할 때 쉽게 결정을 내리지 마십시오!교차로결정을 내리지 마십시오!교차로","나는 무슨 말을 해야할지 모르겠다. 눈물이 떨어지고, 너무 고통스럽고, 떠나고 싶니?",O
